{
  "$schema": "https://json-schema.org/draft/2020-12/schema",
  "type": "object",
  "properties": {
    "id": {
      "type": "string"
    },
    "unit": {
      "type": "string",
      "const": "km2"
    },
    "points": {
      "type": "array",
      "items": {
        "type": "array",
        "prefixItems": [
          {
            "type": "string",
            "format": "date",
            "pattern": "^(?:(?:\\d\\d[2468][048]|\\d\\d[13579][26]|\\d\\d0[48]|[02468][048]00|[13579][26]00)-02-29|\\d{4}-(?:(?:0[13578]|1[02])-(?:0[1-9]|[12]\\d|3[01])|(?:0[469]|11)-(?:0[1-9]|[12]\\d|30)|(?:02)-(?:0[1-9]|1\\d|2[0-8])))$"
          },
          {
            "type": "number",
            "minimum": 0
          }
        ],
        "items": false,
        "minItems": 2,
        "maxItems": 2
      }
    },
    "areaP95Km2": {
      "type": "number",
      "minimum": 0
    }
  },
  "required": [
    "id",
    "unit",
    "points"
  ],
  "$id": "https://ava-sipi.dev/schema/reservoir-series.json",
  "title": "reservoir-series"
}
